Insult,Date,Comment,Usage
0,,"Um, no, I don't actually, because there's one g-spot. You just proved my point. I've no idea where you get your facts from. You also seemed to put many, MANY words into my mouth. I said nothing about love, I said nothing about sex. I said that the way in which gays act would not constitute into a relationship but instead the friendzone. Many characteristics that gay people have can be seen from those in the friendzone. Good day."
0,,"This is hilarious haha marry the crap out of them"" _ indeed very easy."""
0,,lol
0,,a mother fucking quiche... bitches. he will make it.. and your girlfriend will love it.
0,,We'll marry the crap out of your girl friends!  You're death stars and we're faaabulous Luke Skywalkers!  ROFL!!  So may good lines!
0,,"That kinda kills the purpose of being gay, you sound bi. There's a difference."
0,,....fags...
0,,"I think this video backfired, because whether you're a supporter or not, it makes some of us girls want to not support it even more just so we can have a handsome gay husband for ourselves lol this video is hilarious!"
0,,Yes!
0,,Well shit....
0,,NOOOOOOOOOOOOOOOOOOOOOOOOOOOOOOOOOOOOOOOOOOOOOOOOOOOOOOOOOOOOOOOOOOOOOO!!!!!!!!! Time to find the GF and drop the L bomb!
0,,"In certain states they don't preform gay marriage, and if you have been married before they won't view you as a married person, completely ignoring the fact that you're married. So I'm not stupid that's actually a thing."
1,,"Fuck, you're a braindead retard, I said there's No law about a Man marrying a Women. Fuck you are stupid as fuck. Don't reply to me again, because you have shit for brains, I don't give a fuck about anything u think or care about. Face it dumbass, this video is not funny it's just stupid."
0,,"give me your address, i want to meet you ..."
0,,What gave it away? :O
0,,"Society is just a structure with no soul. The soul is of the individual. One individual outweighs all societies. And, one individual's revolution outweighs all revolutions in the whole of history, because one man can become the womb for God to be reborn."
1,,"I HOPE YOU GET TO HAVE A GAY KID  CHILD OF UR OWN. THEN LETS SEE WAT UR MADE OF BITCH. I hope you dont treat him like wat ur doing here in this vid. O wait, a lil birdie told ur a sterile and impotent jackass. i pity u jerk!"
1,,U sound gay.
0,,"actually, homosexuality has been found in over 450 species."
0,,Also the only reason there were not a lot of gays back in lets say 1700 america was because people found it wrong so they hid their feelings for the same sex. Thus people died unhappy.
0,,"I thought society had moved beyond this bullshit. Most of the stuff in the bible is outdated nonsense that has no place in today's society. The teachings of Jesus are about the only things that still have relevance- and Jesus taught that all life should be respected- Jews and Gentiles, blacks and whites, men and women, gays straights. You religious fanatics make me sick. How can you possibly support everything in the bible when the entire book contradicts itself?"
0,,"Anyone can make these definite statements...tell me why, not 'what'.How does it contradict itself?You're looking for flaws.... the Bible isn't meant to be read, but read and digested."
0,,lol
0,,"If that were true, no one would ever desire recreational sex.  And yet both humans and animals do, with both opposite and same sexes. Sex doesn't just make babies, it also reinforces bonds and diffuses stress and many other things. Since when does marriage have ANYTHING to do with sex, or reproduction, or biology for that matter? We are hardwired for companionship. Whether that involves sex or breeding is up to the individual. Plenty of people choose not to have kids, or just can't have them."
0,,"remember you take her you fuckin keep her, no returns"
0,,Hell yah that was awesome!
0,,"haha the lesbian one is better! I won't support gay marriage, but to each their own."
0,,"If you're against same sex marriage... don't marry somebody of the same sex."" - the wise words of Wanda Sykes. ^_^"""
0,,Funny as fuuuuck
0,,"Bahaha, boy you are funny as fuck ! I am 100% gay, I fall in love with men, not women, I can fuck girls and guys, being gay isn't about sex, it's about love, anybody any gender no matter your sexual orientation"", I would never have a relationship with your girlfriend, but I would fuck the shit outta her ;) Do you know how to make  a girl cum 3 separate times  hittin' up 3 different g spots ? Cause I do."""
0,,The sex department won't work bronys. 
0,,"Not gay, love my wife, don't care about Gay Marriage"" (It's Marriage right?Love your partner forever?) I am educated, logical, and have many ""Gay"" (Hate that word, everyone is human) friends. And, has none of you fucktards even heard the term ""Any port in a storm""? Mouth, anal, vaginal sex, it happens, all sexes, all animals (Bet you hate Monkeys also!). Get a life! Jeez! If it wasn't for the US Marines, the women in the Navy wouldn't know what sex is! :) (Kidding US Navy) :)"""
0,,"You, sir, are awesome. :)"
0,,But... I cook yet im not gay so.... I want to go to culinary school.
0,,"We're in it!"""""
0,,"I love this vid, I been in convo's, thats sorta of went the same way. Leaving the Breeder, loving gay men. LoL. Also lettiing him know, he needs to step up his personal hygene a lot more : )"
0,,"oh man, I was just thinking about how attractive the guy in the kitchen was, then 1:39"
1,,"Dude wtf? Im not even religious you dumb ass. You dont need to believe in god to think gays are gross. I mean they put their dick in the outs, thats not normal and neither is a man with a man. Simple as that you retard motherfucker quit spamming my inbox FAG"
0,,"Lol, religious or not,  it's perverted. We the educated know dis!"
1,,"And yet, you can't spell. What a wonderful example of the intellectuals of a society you are. Your mother must be so proud."
0,,"For what it's worth, straight guys do the same thing to women..."
1,,"if you don't like gay people, don't be gay. So simple retarded fuck."
1,,Fuck are you Stupid. lmao
0,,Who doesn't like Jesus? He makes the best taco's :P
0,,I have a feeling you're being sarcastic... But I'm going to accept it.lol
0,,LOL. Awesome.
0,,"It's actually true. The anus is usually tighter than the vagina, mostly because the anus is very rarely ever used. Granted, I've learned that women do have the G-spot,"" which is similar to the prostate, but that statement actually proves my point even more. Tighter holes usually correlate to higher sexual arousal, because no one really wants to throw a hot dog down a hallway."""
0,,"You're probably not sorry. And fags are cigarettes, faggots are bundles of sticks. I remember the days when both of those things meant You're a faggot! = You're a faggot!"""""
0,,Sure if your british but you all know what i meant. And can people quit replying to me damn its annoying
1,,"I honestly don't know how you survived all this time :/ I thought all of you stupid bible thumpers died off a while ago and got replaced by those nice religious people whom don't fuck with other peoples shit. Guess I was wrong, have fun following your stupid fucking book while I have fun living a life that isn't full of hate."
0,,"Then fucking marry a woman!If anyone tells you otherwise, you can just punch em right in their stupid ugly faces! <3"
0,,"Actually the government does, or they don't even acknowledged it :/ It's really depressing to see the stupidity that pours from their stupid dusty mouths."
1,,Who the fuck cares if they wanna marry an animal? How the fuck does it affect you in ANY WAY?! Why do you even care that they're around?! Just ignore em! Who the fuck cares about who people wanna marry!? I don't care if you're marrying a fucking goat or a dude with several penises! Wedding cake is delicious so I'd fucking show up anyways! Holding discrimination against people who want to stick their cocks in things other than a vagina or asshole that's attached to a girl is fucking stupid.
0,,"Yeah. You'll marry our girlfriends? No, you'll fire yourself straight into the friendzone. You're gay. You don't know what you're doing. Soz guys."
1,,"You are the most horrible thing that has ever existed. Pretty much up there with Hitler. Due to the fact that he despised Jews (Which is an actual race and social group) and you hate gays apparently, which is also a fucking social group and is defined as a separate race by lawful definition. So pretty much, you're Hitler."
0,,Not even close to right there bud. I don't think you know much about the human anatomy.
0,,"Actually native americans are the rightful owners of the USA. :/ they were here first, offered us land and such and colonists responded by raping and pillaging everything in sight. So technically it's religions fault due to the fact that the only reason they were over here was to Spread the good word."" So it's entirely religions fault that we think the way we do. Which is stupid due to the fact that not too long ago even the fucking POPE chased around little boys. Nothing to do with morality."""
0,,"You do realize that the bible also says that if a child disobeys their parents the parents are allowed to beat them to death with rocks, right? I tend to take everything the bible says with a great big grain of salt because it doesn't seem too realistic when it comes to punishment. You touch your penis even ONCE and your goin' to hell you heretic!"" doesn't seem to reasonable, so it either means it's fake or god is an asshole."""
0,,Love this!
0,,This was awesome. 
0,,"not like, love!"
0,,"If you look hard enough you will find him..."" - Where's Wally.He was hiding behind the fucking Eiffel Tower..."""
0,,Gaw I knew it the whole time! It's those god damn clowns! they get me every time!
0,,"An author is the person who writes the piece. Too blind to know this? I guess it just takes a higher level of comprehension than you seem to possess. Sorry, honey. But you have a nice day anyway. Maybe tomorrow you'll be able to understand simple things."
0,,"Nope, Wrong! You can author/create a piece without physically writing it down like have editors do it etc. If a blind man created a book and used a penman to write it for him who is the one who should get credit for it?"
0,,"I'm not talking about the act of physically writing it. I'm talking about the act of writing, putting the words together. With the bible, that was done by humans, in most part men. It wasn't done by God. If it were, there would be no mistakes in it."
0,,"Low morality = civil rights issues/discrimination/ religion got things right"" High morality = A person's a person, no matter what, and they deserve to be treated as such. Case closed."""
0,,"But women can have sensitive anuses that feel good when stimulated.Also, women do have something that is very similar to a prostate. It's responsible for both the G-spot"" and female ejaculation. Also, I don't think it can be stimulated through anal sex. Isn't biology fun? :)"""
0,,"nothing wrong with being gay! Ok? Stupid coonz, fack use"
0,,"If you are willing, I have a few questions. The reasons I have heard against marriage reform have all been religious in nature, or based upon social conditioning from a religion, ignoring recent scientific discovers. But from a legal standpoint, there are specific things to ask. ~How does denying marriage reform serve a secular purpose? ~How does denying marriage reform not advance a specific religion in law through excessive entanglement? ~How is denying marriage equality not discrimination?"
0,,"Homosexuals cannot bestow the same legal rights and protections to their life partners that a heterosexual can. That's where there's an equality issue.The fact that is discrimination comes from the federal definition of the term, specifically a term used in that definition: social group. The federal definition of social group"" includes sexual orientation as a basis for a social group.There have been complications with states not recognizing certain marriages from other states. O.o.C. Sorry."""
1,,The worst thing about this country is that idiots like you exist.
1,,"You're a special kind of idiot, aren't you?"
0,,The only thing i can say is just LOL
0,,"Could be the dumbest video ever. No one is stopping any man gay or not from marring a Woman. So go ahead gay men, marry a woman, but I don't think you will be very happy and you'll end up divorced and giving her half your money and stuff.. lol"
0,,this was very funny
0,,"LOL funny perspective,  whilst I am for traditional marriage,  I doubt you're going to help/teach anyone talking like that."
0,,lol fags.
0,,haha that was good.
0,,The kind of threesome she wants ? Oh were cool with that
0,,"I'm glad you are able to have a rational, rather than emotional discussion on the topic.  It is a very interesting topic to follow."
0,,"Those state laws in the 50's would often target one race, such as blacks cant marry non-blacks"", which makes the unconstitutionality of those laws pretty obvious.  It isn't truly an apples-to-apples comparison.  There is no perfect precedent set for the legalization of gay marriage.  The Full Faith an Credit Clause applies historically to judgments, rather than laws, and has given State's the flexibility to have laws that conflict with other States' laws."""
0,,"Even if the discrimination isn't overtly there, it's still there. And the case can still technically be made. It's still technically discriminating against the LGBT community by saying that men can't marry men and women can't marry women. Instead of looking at it as gay men and women can also marry people of the opposite gender, it's seen as Lindsey Lohan can marry a man, but I can't."" And while the Clause has been used for that, it's the reason that you don't have to get married when you move"""
0,,"Ok, this was a refreshing and real funny perspectiveGood job! =)"
0,,Know what's better than a vagina? A tight ass. Know what tastes better than a vagina? A dick Know what looks better that a vagina? Anything. Know what isn't where piss comes from? An ass. Know what you can fuck all day and not make a single baby? An ass. Know what smells better than a vagina? Anything. Know what women don't have? A dick. Know what feels better than a vagina? A tight ass.
0,,:'( what if i want them to marry women....
0,,"All these God and Bible followers need to shut up. You contradict yourselves all the time. You preach all this God loves you no matter what and he made you perfect"" and ""Love thy neighbor"" shit, but then when you find out someone is gay you say ""God hates you."" Oh, really? But God...created them, right? You can't even stand by your own word. Why use the bible if you're not gonna use it correctly? How about you keep your opinions to yourself."""
0,,...and no we weren't just checking out that other girl :D
0,,A mother fucking Keith.
0,,LMAO!!! Win.
0,,So many wins
0,,Mother of mine. . .
1,,EXCUSE ME. the whole ''gay is illegal'' thing was added to the bible in 1980-ish. now SHUT UP
0,,The bible was written by God was it? Interesting
0,,"Authored by God, written through His followers."
0,,LOL I'd gladly marry them!
0,,"What's a buiscuit?"""""
0,,"Actually, from what I've heard, the anus can be tighter than the vagina. Granted, a woman having anal makes little to no sense. Not because they don't have anuses, but because they don't have prostates. In any case, men have shown to prefer anuses to vaginas, even if it's on the opposite gender."
0,,yesssss....I was checking out those double D.
0,,hahah so fucking true
0,,bullshit
0,,Cause Sandra is being a bitch
0,,"An 18yr old with an associate's degree/construction job= retarded? mhmm.. definitely true. Native Americans don't own most of the USA, and majority rules over minority. So that don't count. Sure, with religion n stuff there was some stuff in the past that was wrong but there were many things they got right. Tradition and religion have nothing to do with it tho. Morality is what it is. Low morality=anal intercourse/female on female. High morality=intercourse between man and woman. case closed."
0,,"Oh lord. Another person who doesn't read the entire comment, or even attempt to understand it. I didn't say you were retarded. I was pointing out how you say that anything you don't like is retarded. Since you can't even understand that, it's going to take too much effort to talk to you. You can't just say that something is true and consider a case closed. You have to actually have proof for it."
0,,"Gay ppl already have equal rights- the right to marry someone of the opposite sex.Marriage laws have always been defined by individual states.  That's why you get a marriage license for the state where you are getting married.  Gay ppl aren't arguing for equal rights, they are arguing for an expansion of the law.  If you want it, change it in your own state or move.  But don't bother me about it."
0,,"Technically, it is state by state, but the Constitution also holds the Full Faith and Credit Clause, which allows married couples to not have to reapply for marriage when they enter another state, among other reasons. This would make DOMA both illegal and unconstitutional.Also, back in the 50's, someone would have said that white and black people already have the same rights. They can both marry a person of the same race."
0,,I kinda wish we stop approving Gay marriage now though lol! Why can't i have a man like that (sighs dreamily)
0,,well put
0,,"hehe soals"""""
0,,perfect
0,,Fags. I couldnt watch the whole vid cause there was too much gayness
1,,"You LIVE in a country where gays get MARRIED, you just CLICKED on a GAY video, and commented on a GAY video...Not to mention you just read a comment written by a GAY guy...Honey, u've been covered by gayness, u better go see ur doctor and make sure he does a rectal exam to see if ur butthole is dying to take up a dick."
1,,"I live in a free country I watched a collegehumor video I commented on a collehumor video Im definitely not gay, that grosses me out. You should go see a doctor so he can check if you have aids. Dont call me honey"" you freak"""
1,,you are a fucking douche though
0,,Ya i can be but honestly fags dont bother me unless theyre really flamboyant or just over the top. I usually mind my business so sorry for offending any of you
0,,"Know what's better than a b-hole? a vagina. Know what tastes better than a b-hole? vagina Know what looks better than a b-hole? a vagina Know what isn't where poop comes from? a vagina Know what it takes to make a baby? a vagina Know what smells better than a b-hole? a vagina Know what men don't have? a vagina Know what feels better than b-hole? a vagina And the two worst things about this country: Obama is president, doing nothing for us, and in some states queerosexuals can get married."
0,,"They don't need an army. They have Neil Patrick Harris. If he wanted to, he could get every woman on the planet."
0,,But religion was something that humans came up with so that we could re-connect with each other and not be constantly fighting.  Humans also came up with religion so as that we as humans could be moral.  Thats why there are so many different types of religions.  Also the only right religion is to each his/her own.
0,,"I honestly hate the word 'religion',  it's a disgrace now.I like 'Jesus'.  And yes they're two different things."
0,,I like you :D well put
0,,100 % a comment saying : 3.444 house wifes married a gay guy. ITS TO OLD
0,,gay people should be sent to an island somewhere or condemned to a mental institution for life along with the animal fuckers because they share the same frame of mind. disgusting scum
1,,"people like you who are narrow-minded and obtain pleasure only  oppressing others who are not like you are the real disgusting scum"" of this planet. People like you who are filled with hatred for people who have done nothing wrong to you cause sufferings and problems in this world. You should really reflect on your life."""
0,,na she be right mate
0,,if people are aloud to marry someone of the same sex the next thing will be people wanting to marry animals.... imagine that your at your family christmas dinner and your brother turns up with a Pig of a wife liturally. or your a farmer and someone turns up and asks for permission to date one of your cows.
0,,"[slaps forehead] Animals don't have the ability to sign a contract. Therefore you cannot enter into a contract, such as marriage, with an animal.Do you have no clue about our legal system?"
0,,I would totally marry my gay bestfriend.
0,,"ducks, monkeys and many others mammals are homosexual. male pinquins try each other out to get experience before they try a girl. so yes, you can be born gay."
0,,I love it! Very funny!! 
0,,"Actually it is heavily documented that even in ancient Roman and Greek times, homosexuality was acknowledged, practiced and accepted."
0,,Dolphins are gay hahaPeople are definitely born gay- often there is great upheaval in their lives when they find out they're gay
0,,Hahahaha!!! Awesome!!!
0,,"But your books were written by humans, there's the difference."
0,,"Newsflash, cookie: so was the bible."
0,,"Nope,  it was hand written by humans, but humans didn't author it.Too blind to know this?It takes a higher level of reading comprehension than you seem to have.  Good day! ;)"
0,,Its not legal in america?!
0,,MARRIAGE FOR ALL _
0,,burnt scrambled eggs?! she'd be lucky. il make her toast or she should be up before me making me breakfast.
0,,"Well you can't blame the gay community for not caring about a group of people that hate and opress them. At the end of the day Gay people just want the same legal rights that straight people get with marriage, doesn't really matter what you call it. However, I still think the argument regarding why it should not be called marriage is weak. Marriage is not just religious, but is also legal, unless Marriage is only Religious I don't think Religion can exclude the term from other groups."
0,,"That's absolutely correct marriage doesn't have to be a religious ceremony but why do Gay people choose to do it that way? Why not a civil marriage? Why follow a tradition from a group that has oppress them for so long? Could it be that the propaganda from movies, tv and such brainwashed people into thinking that marriage HAS TO BE in a church under religious tradition in order for it to be official?"
0,,gay people have no soals
0,,"If a civil union"" granted the same rights and legal protections as a ""marriage"", then it wouldn't be an issue. The point is that they don't. It has nothing to do with religion."""
0,,Calm down sweetheart. I'll make you any side-dish you like.
0,,mashed potatoes!!! :D
0,,She hasn't officially said yes yet. Maybe I could seal the deal by having her over dinner. Let her have the mother fucking quiche for free before... buying... the ingredients to make the mother fucking quiche with... you know what I mean.
0,,So then what happens to all the lesbians?? do they marry all 'your' (meaning strait women) boyfriends? hmmmmm... seems to me you just lost 99% of the strait male vote! ;P
0,,"Just... Yes. I'm SO against Prop 8, and I do believe that if we illegalize gay marriage that they will take over the world and marry your girlfriends. And your girlfriends won't have a problem. YOU will."
0,,Since evolution. We are hardwired to breed. Pretty much every species is. This requires you mate with the opposite gender. It's how they survive and propagate. This is fact. Humans weren't always intelligent.
0,,yea we do... its chocolate... right?
0,,some of us might even think of your husbands whilst we're making love to you  : )
0,,lol we could literally play them like a bass lol sorry that cracked me up lol
0,,"I love reading these comments, most get the joke but every now and then a Nazi Fascist pops up with Kill The Fags. Truly funny and tragic. I live 10,000 miles from America whew!"
0,,"well i couldn't care less what you think, gramps, because i am far from a slut"
0,,LOL... gramps?!... im 23 in that photo (fake mustache).
0,,that's irrelevant. the point is i'm not a slut. i made a joke. quich and hummus don't even go together! =)
0,,amazing
0,,Ignorance is being displayed all over this channel...disliked.
0,,"No shit, I'm with you on that one, i mean really... quiche with hummus? what the fuck?! WHAT THE FUCK?!"
0,,I always say Neil P Harris and Elton John are the only reasons I need to support the gays.
0,,Also Freddie Mercury.
0,,"In the first election I was allowed to vote, I'm proud to have voted for Obama, the first president ever to support gay marriage! :)"
0,,"Sorry I didn't mean to generalize. But no, it isn't bad that gay RELIGIOUS people want to get married under their God but for Non-Religious people to want to get married under a God they don't care about is completely ridiculous. And lets be real here, the majority of the Gay community doesn't a give fuck about God\religion. But Marriage in a CHURCH is still considered sacred, while others forms of marriage, not so much."
0,,A MOTHER FUCKING QUICHE !
0,,"All I know is... Chris Colfer can marry me any time he wants (if you don't know who that is, you're lame);)"
0,,@ram xtc Um...no. How old ARE you?
0,,I cant get enough of this video!
0,,are gay people guys that wanted to grow up being girls?
0,,Too bad the guy with the tie and curly hair is gay.. I would marry the crap outta him.
0,,Well played!!!   lol
0,,Perfect time for trolling...And yet i'll skip. I must go and see a doctor.
0,,"statistically, gays have bigger penises. eight inches and less to the left please, nine inch here coming through."
0,,JOKES ON YOU MOTHER FUCKER!!!I'm a straight man... With feelings!!
