Insult,Date,Comment,Usage
0,,"That's pretty funny and ironic actually xD Calling someone horrible for hating gays and then proceeding to pray for them. Not saying that your religion is one that dislikes gays, just saying that in many cases; religion and homosexuality go together like drug addicts in detox together."
0,,"Well I suppose you aren't at Hitler status yet, but you're discriminating against a sexual orientation based on nothing more than silly unjustifiable beliefs. There is no proof nor will there ever be that gays are the reason for social and political downfall in a country. They aren't the cause and never will be. They aren't causing a problem at all. People like you who decide that something is wrong based off of stupidity cause problems. But at least you aren't being rude to me so thank you."
0,,OMG THE FUNNIEST MOVIE IN THE WORLD!!!
0,,lol i will tell you if some gay like this guy's try too make out whit my gf? i'll join the gunshop and shot them 1 by 1
1,,"If you think that ''God'' is natural with not supporting homosexuals to get married in all his Glory and he created the earth, the sky, the seas and all the species in it.  Why the frack did he create 1500 species homosexual and only one wich is homophobic? Seems to me he absolutely adore homosexuality! Put the bullshit back in the mouth where you can have the taste for yourself."
0,,This is the best video on the Internet.
0,,im eating a mandwhich atm. not spilt it though!
0,,Fuck gay marriage bitchhhhhhh
0,,That was wonderful.
0,,someone email this link to Mitt Romney
0,,BAM! 
0,,"Ippo pelease don't say that, if you have actually read the bible you'd know God doesn't hate gays"
0,,@cate00149 thank you!!! good point
0,,@Andrew Gibson obeying god? is that what your supposed to do? eventually every fucking country goes down. it just so happens that the US is sucking ass right now.
1,,You are a horrible person. I will pray for you. Pray that God forgives your evil deeds and cures your twisted mind.
0,,I dont hate gays but I'm pretty sure god does.
0,,God loves all his children.
0,,HahahahHa
0,,"Lets face the fact it would be a divorce shortly after, for one gay men wont sleep with a woman and two the woman or man would leave because it would be too perfect and without drama, the gay friend isnt needed as a shoulder to cry on. So your message is invalid and there are plenty of flaws but comment texts are limited"
0,,"I wonder if the saying, You made your bed, you can lie in it"" has anything to do with this?"""
0,,Make my girlfriend breakfast??? What color is the sky on the planet where a straight man makes anyone's breakfast... unless he's a widower with a small child?
0,,"Why did you click on it for gods sake it has GAY"" in the title."""
0,,omg people stop replying to me ffs!!!!!!! And cause i like collegehumor and i give all of their vids a chance? What kind of question is that? Am i not allowed to watch because i found out after it was annoying?
0,,"I'd just like to say, as a homosexual myself, that if you are offended when gays kiss, why are you not offended when straights make out in public areas where children play? If our public show of innocent affection is more offensive than your pornographic, short-skirt wearing, ass-grabbing, perverted straight PDA, then I beg to understand the logic in your reasoning. Also, the fear and hatred of gays is the same fear as interracial couples. Here's the news, you're a mutt."
0,,"a mother-fucking quiche"""""
1,,When gays are not sucking your dick or fucking you b-hole..then what the fuck is the problem? leave them alone.
0,,"I believe that gay marriage is why the US is not doing so good. Look at ancient Rome for example, their empire fell when they started doing immoral acts. All I think is that we are just repeating history if we support gay marriage, but most of all we are not obeying God if we are not having marriage between a man and a woman."
0,,"The roman empire lastes 800 years, will America Last 600 years more, can you assure it? and anyway, only the western part of the empire was sacked, the eastern part, ruled by the byzantines lasted until 1450, yes 1000 years more, and they were Christians, in fact they are the only reason that your religion survived because byzantine emperors persecuted other religions after becoming Christians."
1,,"Please don't quote my earths history as though you know anything about it. Just quote the bible, no one gives a shit when you do that anyway."
0,,Hallelujah
0,,"Dear comment section, thanks for reminding me why I have no faith in the world. Sincerely, MoD. P.S.  Please remove your head from your ass."
0,,I did not know women liked to go to the gym. They are never there when I am there.
0,,"really? I though I was strait for all of high school and most of college, when I have like all of the naked men I have see, I only like about 40% of the vaginas I have seen, plus gays take much better care of themselves."
0,,"this video just proved at 0:30 that we are much more fit than you, so bring it on, bitch."
0,,"I bet you've heard things like, this is what's wrong with the country"" but I've got to say, you're embarrassing to all of the smart American,s and by calling yourself a Texan, and saying all of this on YouTube obviously shows how much you care."""
0,,Your girlfriend sucks dicks. Your dick. See the similarity? How about we take away your right to be with her.
0,,"god doesn't agree with pre-marital sex either, but i don't hear you complaining about that."
0,,It is God not god. I know but am dealing with homosexuality at the moment. God hates it when people justify the act of homosexuality and  conclude  they see nothing wrong with it. Dont ever reply back to me am done with this topic. You have choice! God does not force anybody. I cant repeal the truth of God.
0,,you also have the power not to spread your unintelligent views on youtube
0,,2 guys 1 girl having sex. AIDS! 2 girls 1 guy having sex. CUMSHOTS!
0,,I want to marry a gay man gosh y'all are awesome!
0,,"As a bisexual man: game on, motherfuckers."
0,,I thought the vid was good till it said support gay marriage......
0,,how is it a stretch? both of you hated a group of people for no reason
0,,How gay
0,,I agree with you!
0,,Lol
0,,I think it says that gay people goes to hell
0,,marry  me :)
0,,Gaylord
0,,"@ChunkyBuiscuit - If you're that desperate for a bit of old fashioned male on male physical contact, just ask them.@ Nozzy1110 - So what? So does your mum.... and that's not even an insult, just an observation."
0,,"Homophobics' vision are clouded by the morale of their religious books to think for themselves, typically; the mindset of individuals with these binding characteristics think linearly. Does it matter if another man or women married? Also, calling them 'sick', what gives you the undisputable rights to make such a diagnosis?"
1,,"Actually the opposite. But keep assuming stuff about people you dont know, makes you look smart."
0,,"But why do you choose to obey some messages your book says and hold it as god's word"", yet ignore others"""
0,,The name is God and not ''god''. The little god is man made false god. There is only one God; which is the God of the bible and his son Jesus Christ. Every other small god is a deception. In order to have access to God you need to accept Jesus Christ as your Lord and personal saviour.
0,,They really should show this on t.v just to see peoples reactions!
0,,We will support gay marriage XD
0,,And than? I would kill you and bury you...Have not more to say >:)
0,,No i would kill them if they tried that
0,,thumbs down if you won't support gay marriage.
0,,"And if god"" is so against homosexuality, why did he create such tendencies in his creatures (animals) that are unable to reason much outside instincts?"""
0,,"Buddy; He is simply God and cannot be bargained with but we can however obtain mercy through Jesus Christ his son. In order to obtain mercy, you would have to acknowledge Jesus as your Lord and saviour by believing that he died and rose on the third day. Romans 10:9"
0,,"*too,*agree, clearly your grammar is not perfect. No I am also trying to speak the truth here. The truth is our country is not run on your book. Also, why do you pick and choose what from the bible you wish to obey? So do you also see working on sundays as a sin? Are you against rounded haircuts? Women speaking in churches? Like I can't even comprehend how people believe the bible in general, its created by sexist,racist,homophobic men of that time who used it as a means of control"
0,,My Grammar might not be perfect but i can vehemently admit that it is apt or standard to the avid reader.
0,,Well luckily our country isn't run on what you think.
0,,"Well you can have your homophobic opinion all you want, but you actually do not have an argument, you just reek of fear. Lmao you blame Obama as you sit here ignoring all the issues in this country and focus on stopping the happiness of other people..."
1,,Chunky biscuit..... Just from that name I'm gonna take it that you are a closet broke back mountain type that takes it up the ass and venting out your hatred to try and prove to your friends that you aren't a pillow biter. I am sorry you aren't secure with your sexuality but you shouldn't hate because there are more gays out there that you would never think. So next time keep your hatred and comments to yourself.
0,,"Well fortunately our country is NOT run based on your book. So if you don't like gay relationships, don't have one"
0,,"Have you even thought of WHY it makes you uncomfortable? Afraid of social change? insecure about your own sexuality? Jealous that they have love while you don't? Like what actual reasons are there other than homophobia? Get over yourself, there are starving kids DYING, people that are sex slaves, families torn apart by war... and you focus your anger on gays because they make you uncomfortable? Wow you are ridiculous."
0,,someone is insecure with their sexuality.
0,,And women do not .... ? 
0,,Umm yes but they are women
0,,"ummm you said gay people suck dicks"", as if implying that it singles them out . You said the reason you don't like them is because they suck dicks ... yet many women ""suck dicks"""""
0,,lol I'm so glad that Britain already supports gay marrage
1,,What is wrong with you mr. ping pong
0,,All people like going to the gym
0,,Gayyyyyyyy
1,,"So you would start a fight with two guys kissing, to try to get one of them to go down"" on you? Pathetic."""
0,,A mother. Fucking. Quiche.
0,,Exactly.
0,,I would marry my gay friend in a heartbeat. He's the best!
0,,Put*
0,,I don't understand why they out the gmm tune on this...
0,,That is so right finally someone who understand
0,,omfg LOL who the fck would want u f@gs.....-_-
0,,Lmao I hate people but this video is fact
0,,Gay guys are sick
0,,"I do hate gays, but comparing me to Hitler is a stretch. I'm more like a Texan than Hitler. And trust me, there are many other guys and girls out there who hate gay people. They just don't have the balls to say that they do when this country has gone to shit starting to be okay with gayness. I have not taken any physical action against them, but if I see a gay kissing someone or doing something gay in public I will call them out on it. And if it becomes a fight, that queer is going down."
0,,Why?
0,,Because gay people sucks dick
0,,"If they're sexually active, then probably. Why does their dick-sucking offend you? Are you afraid they'll suck on your dick without permission?"
0,,"Ok, first of all -- how sad must be one's life when he/she wastes precious time of his/her life to hate millions of faceless people? Do you hate the population of hairdressers too? Vegans? Or is it really hatred? A few minutes of reflection wouldn't really harm you. At least I think so.And secondly -- I know it's ridiculous (just as this whole argument), but I'd dare you to_ nag some massive bear guy. We'd see if it would be the queer"" going down."""
0,,"Oooh may gay. That was... I may have spilt my drinks. See! We are superior! And I spelt that wrong. Oh well, I never said perfect."
0,,If you realyse it does make sense to heterosexual guys... Ha!
0,,fucked up but good to know
0,,I love this!
0,,IN LOVEEE W THIS!! <3 <3 ;)  GO GAYS <3
0,,I don't understand I thought marriage is supposed to be between a man and a woman.
0,,"Still won't support gay marriage, but hey, I got to admit, this makes a pretty funny and reasonable idea hahaha. Thumbs up."
0,,Hahaha! That was awesome
0,,"Facts don't change with your perspective. You might gain a better understanding as to why something is a certain way, but it won't change things like basic biology."
0,,"When you live in a world of illusion it does. Your attachment to a certain reality or part of, your problem."
0,,"See, I don't live in a world of illusion. I live in a world that has verifiable concepts that can be logical processed as well as backed up by scientific data that is capable of being replicated. That's not a problem. It's called reality. You, on the other hand, really need help figuring out the line between fantastical products of your mind and reality."
0,,"Hi. I'm Margret, well, Magi, actually. My best friend aside from my husband is a man named Matt, who has been with his partner Jared for about seven years now.You can now say that you've met a woman who considers a gay man her best friend."
0,,A mother effing quiche.
0,,Three random words do not answer any of the questions in my post.Try again please.
0,,This was funny.  two thumbs up.
0,,I dont intend to codemn anybody on here. Am only trying to speak the truth. Am a not perfect to. Let me ask you a question; does God agrees to homosexuality?
0,,"Yes. He does. I just asked him, who the fuck are you talking to?"
0,,Okay; your only problem with me is that you want me to justify homosexuality and call it good right?
1,,"Oh, I have several 'problems' with you. The main one being that you use God as a springboard for hate. Get a life, shitwad."
0,,I love homosexuals buddy.
0,,"lol but what about all the other sins you so blatantly ignored? Are you not going to go to Hell for all those, too?"
0,,Am not perfect i make mistakes just like anybody else but the bottom line is God hates all forms of sins including homosexuality. God only has a problem when we justify something he hates. God loves everybody including homosexuals but he hates sin. Am not judging homosexuals but am only presenting the truth.
0,,"Am sinful by nature; that is why i try as much to follow Jesus Christ. If i was a perfect candidate i wouldn't need him. Unfortunately am not; Jesus is the only perfect immortal that died for my sins. His precious blood gives me a sense of entitlement to approach his throne. If one is struggling with stealing or homosexuality, then the only alternative is for them to accept Jesus into their lives and make him The Master of their life. In doing so, He will deliver them from it because he hates"
0,,it.
0,,are you aware that god is not real
0,,WHAT IS THE NAME OF THIS SONG!? PLEASE TELL ME SOMEONE!
0,,what the hell is bubbaganush?
0,,"Lol, insults. How surprising. Who'd have expected that on Youtube?I'm a way too old for MTV btw. But hey, whatever pleases you. It's probably easier to nod to whatever you have to say."
0,,"As a Christian, I'm supposed to think that Homosexuality is wrong. BUT I DON'T! BISEXUALITY FOR THE WIN!"
0,,What do you not understand is that the bible is writen by men. Even the bible states thst no man is perfect you go on living your life according to the words of other men. There is no proof that god told them what to write.  do you know what would happen to someone these days that claimed to speak to god? Hed be locked up and put on meds thats what.
0,,The descriptions of these gay dudes totally describes me though. This must be why people think I'm gay.
1,,"Even though I find your claims abhorrent, it would seem that you have the correct interpretation of the bible (seeing how it says it right there, you'd have to do some crazy mental gymnastics to flip that into 'not against homosexuality'). Its funny how many people try to discount the very bible they supposedly believe in. Just one of the few perks of being a non-believer! Oh, and, fuck you."
0,,"This made my day, so true :-)"
0,,"my mother was gay and was married to my dad for 13 years before divorcing my dad when I was eight. I now have a large and happy family and I was raised well. All I was saying was that though I would rather marry a straight guy, if I could help homosexuals have the right to marry by being shocking and a pain in the ass. I would, even if that meant having my best and gay friend as a husband."
0,,"Therefore I take pleasure in infirmities, in reproaches, in necessities, in persecutions, in distresses for Christ's sake: for when I am weak, then am I strong. -2 Corinthians 12:10  It's for Christ, not the church.__Trust in the LORD forever,for the LORD GOD is an everlasting rock. Isaiah 26:4 His wisdom is profound, his power is vast. Who has resisted him and come out unscathed?   Job 9:4"
0,,Thank you! We really need the support and the marriages!
0,,"God, Country, Family."
0,,A homosexual can still be a family.
0,,But your not leaving my belief alone. so no.
0,,hey guess what if your chritsten that dosent matter any more well unless you wana stop cuting the hair on the sides of your head eating red meat and getting tatoos
0,,I SURRENDER! i support gay marriage... 
0,,I. Am. So. Scared...
0,,Why should anyone care what your god wants? Clearly your god doesn't care what humans need.
1,,shut up you bible thumper
0,,i feel like i've been waiting for this video my whole life
0,,"Love thy neighbour as thyself."" (Mark 12:31)"""
1,,YOU GOT TOLD LMFAO!!!!!! all that quoting of the bible while u gonna end up burning in hell for judging people anyways. Wouldnt that suck? To end up in hell next to those god damn homosexuals because u were judging them? lmfao ima look at ur ass and say... U MAD BRO??
0,,"the bible is a book written by very clever people a long time ago to make other people behave exactly how they want them to, not that it isnt responsible for good things as well. this doesn't mean im an atheist, i believe in some sort of creator, but taking the bible to be gods"" truth is a pure idiocy, i mean why the hell would god care if a man cares for another man, i can see literally no negative repercussions in that scenario"""
0,,Where in it lol im dieing
0,,A mother f#%#%#g keish lol
0,,its spelled quiche just so you know
0,,"I do like the idea, but I do not like the stereotyping. I do not partake in anything those guys mentioned besides the gym...... and maybe a little pinkberry.......  anyway, apron guy is cute"
0,,Actually 95% of what they said are true. Gay Men know women better than their boyfriends do so much that if the gay guy were to be straight he'd be the perfect boyfriend/husband for a woman. It isn't stereotype it is fact. Women share their most deepest intimate secrets with gay men. They don't even share it with other women. Straight women and gay men have a very special relationship.
0,,"Aha? So you have made some studies on this field? But remember that you need some few thousands participants. And all of varying age, regions etc. I have yet to meet even one women that considers a gay men her best friend. This isn't even a stereotype, it is a TV-made illusion that might be real in Hollywood.Anyway, funny video. And that's the only thing that matters. :)"
1,,Well you need to turn off the MTV and VH1 and start going out more because what I am saying is true. I have friends and I know people personally that are women and it is true they will tell you that they have gay male friends that are their best friends. You obviously live under a rock. Try coming out and getting some air and see for yourself!
0,,humorous and appropriate. Subtly challenges our society: where discrimination and unfairness is still yet predominant. 
1,,"Oh, sweet moon, you are nuts. I don't know why I expected logical reasoning from you, but I had, so now I find myself surprisingly shocked that you are off your bloody rocker."
0,,"I have never been one to conform, and fit in with the status quo. After all, who want's to be like cattle or sheep. Everything you believe, is true. If you think it is bad for you, it is."
0,,u realize this video is sarcasm right?
0,,"ahahaha this is genius, I love this."
0,,DAFUQ did I just see?! lol
0,,Good one :D
1,,"So, threatening to use women to get your way is suppose to force people to change their minds? You must be related to Nancy Grace or you are infected by the NGC (Nancy Grace Complex: Your way/opinion or no way/opinion; no matter how low you stoop, you will get your way while hurting and damaging others because in the end, you're a whining and bitter bitch)"
0,,They've got some good points
0,,Religion has no place in government. It is the 21st century. Times have changed. It is NOT against the law to have your own religion. My religion does not say god hates gay people and its wrong and they're going to hell. Just because yours does doesnt mean it will happen. Its all irrelavant to the point. Human rights are being trampled on due to religion that is being forced on us and that is wrong.What harm will u suffer if I marry a woman and not a man?You dont have anything to do with my life
0,,And how the heck did this turn into a debate about food? This is about gay marrige and why we as humans treat other humans differently just because they choose to have relationships with the same sex. Which is not the business of anyone not who is not included in said relationship. why should religion have anything to do with it. the bible is a book of stories. Thats it. Does harry potter say gay marrige is wrong? U might as well be reading that. you believe these stories because you are told to
0,,Oh shit. We are so fucked up assholes.
0,,"We enjoyed watching this beautifully well-made presentation. Would you accept to peruse our hand-pcked"" gay-themed playlist? Love is so much better than hatred!!! We wish you all the happiness you deserve. __ Guy & Chris, a Canadian gay couple for nearly 31 years so far"""
0,,"I'm never going to stop arguing for human rights. A person is a person and always deserves the same legal rights and protections under law. It doesn't matter race, gender, sexuality, religion, or ability level. The Government does not have the right to deny anyone rights and legal protections. This isn't a fantasy. It's a goal, and a worthy one.Grow up and join the 21st century with the rest of us.Btw, your analogy is non sequitur. You should really work on that."
0,,"I agree that we should have equal rights, I was saying that human beings them selves are not equal. Two different subjects."
0,,"Humans beings themselves are equal, though. That's why we all deserve the same rights. Equal does not mean the same. It means equal."
0,,"Meat is a natural source and it is the one from which our bodies are designed to get the proteins. That's why we're designed as predators. (Remember the eyes and teeth thing I mentioned?) And did you know that pure vegetarians die an average of fifteen years sooner than those eat a balanced diet that include meat? Youtube destroys links. You can't even copy the url out and paste it, even if it were correct. Link sharing just doesn't work."
1,,"I don't know where you get your facts from. It's is sad to think that people have been brain washed as much as you. You are not nearly as bad as most of the world though. Your statistics are wrong, and your nutritional facts are wrong. Maybe if you knew anything about eating healthy, you would be in better shape yourself. I do not need to argue my diet, I am the healthiest member of my family and friends, and honestly you can just look at me, and tell that I am going to live for a long time."
1,,You are clearly delusional. Good luck to you.
0,,"The energetic pathways in your body and brain are being messed with by your hormone, and antibiotic filled meats. I have done my research, and I get every single nutrient I need as well as ample protein, carbs, etc. I have not aged in the last 5 years, in fact I have actually reversed ageing. Of course you will continue to think that you 'need' meat, and you will die with the rest of the meat eaters. Vegetarian lifestyle is the key to long life. You have obviously been misinformed."
0,,"1) You've aged. It's a fact of life that cannot be escaped. Don't delude yourself. 2) You do need meat in your diet. You are right about not needing the extra crap that most commercial meat has in it. That doesn't mean you swear off entirely. That means you shop better. 3) The fact remains that the human body needs meat to survive. We're omnivores. That's how we're designed.If you want to list a moral reason for it, fine, that's your choice, but don't argue that it's healthier when it's not."
1,,"I hate to keep telling you that you are wrong, but have a nice life, and you're wrong. I couldn't even respond to the last 2 comments due to me not wanting to stoop down to your level, which I have already stooped down farther than I wanted too. Enjoy your life, eat your meat and enjoy the burnt flesh and blood. You are just another sheeple in the world, that will die a meaningless death probably not having accomplished anything of significance. Sorry, but it's probably true."
