Insult,Date,Comment,Usage
0,,Love it so funny
0,,"HAHA i think this is a very clever video. And i am all for gay marriage, i support it. But i cant see females marrying gay men anytime soon."
0,,this is just sooo awesome man
0,,What a sad ending....Terrible bed time story shame on you sir...
0,,I cannot compete with a ceche
0,,"i am gay and way butcher than these guys but yes, beware.  we make them feel way better about themselves. and our cologne doesn't reek."
0,,a motherfucking ciche guys 
0,,Not every gay man is feminine.
0,,A MOTHER FUCKING KEESH
0,,CASSANDRA IS BEING A BITCH!
0,,Awesome !
0,,I don't give a shit if you marry my girlfriend go right ahead she's a slut anyways she will go for anything that move including gays lesbians and bisexuals so im fine with it
0,,"its not like that in every relationship, its pretty stupid to say that"
0,,HA GAYYYYYYYYY!!!!!!!
0,,"I agree, i don't like them either. Yesterday one faggot followed me and as I turned around he would hide behind a tree or something. Jesus It was so awkward and weird dude..."
1,,"*BERRRRR* Sorry, incorrect. Don't use your stupid fucking stereotypes when talking about gay couples. I am feminine, but I have tons of gay friends that do not associate themselves with feminine things such as I, and vice versa with my lesbian friends. The only reason I feel the need to look pretty is because I like to look pretty. Not because of my sexuality. Seriously, just fucking, stop."
0,,"Well that was scarry. I support gay marriage just as long as both chicks are hot.... Oh, and own a camera."
0,,And that's the story of why no one likes you.
0,,Is that guy in the kitchen wearing the Dexter murder shirt?
0,,Every straight guy needs a gay friend.
0,,BEST THING EVER
1,,hey dont mock gays ...faggot
0,,"I still love this video so much. Seriously I love you, college humor. I love you!!"
0,,you are death stars and we are an army of fabulous Luke Skywalkers! haha Awesome!
0,,I still love this video :)
0,,Thank you!
0,,"So, you gave no legitimate reason to hate homosexuals. You just stated something that doesn't really have any weight to it at all."
0,,pseudo-conservatives?
0,,"Oops, I meant any of these guys XD"
0,,Maybe some lesbians wish they were men and some Gay men wish they were women.. Duh..?
0,,Well in my opinion a girls vagina aswell as the b-hole can feel really good :)
0,,So do you feel awkward if you think a women next to you is attracted to you?
0,,"Wait, you just made an anti-gay comment, but you're defending incestuous persons.Oh, sarcasm.I should make it clear, I'm against discrimination against either kind of person."
0,,"If your a woman, your probably in the clear.If your a man, all hetero women aren't attracted to you, right?"
0,,i want quiche...
0,,@Scarlet3Foxtrot I agree on what you have said.
0,,"Look, we found another one!"
0,,CRAAAAABBB PEOPLE!!!!
0,,That's discriminating against incestuous people. How is it any different from homosexuals. It's just two people loving each other right?
0,,They wouldn't feel the need to be girly if it wasn't because you're supposed to have a man and a woman in a relationship.
0,,"If it's normal for two men or two women to be in a relationship, then why does at least one of them act like the opposite sex. Why do gay men feel the need to be feminine, and why does as least one female in a lesbian relationship dress like a man and cut their hair short? BECAUSE YOU'RE SUPPOSED TO HAVE A MAN AND A WOMAN!"
0,,y'all as republican im a little Redneck but i think Gay marriage is a constitutional matter and the Sutto-Concervatives aka Teapartiers are Policy Mavericks and dont uphold anti-discrimination law because it will hurt their cause
1,,"Fine marry my girl friend,i will fuck ur boy friend ...bet i can. One more what are u going to do when she goes crazy mode. Women at that point dont want to go dancing or ur fucking quiche all they want is to stab u with a fork. Takes a real man to deal with a women in crazy mode....plus who will change the tire take out the trash clean the gutters and im pretty sure her father hates ur butt lovin ass"
0,,This is the most fucking brilliant thing I have ever seen.
0,,OKAY SO WHAT THE HELL DOESN JESUS HAVE TO DO WITH THIS VID
0,,Two words: challenge accepted.
0,,in just 1day you became the most hated user in this video (that i know of) how does it feel?
0,,"(continued 4)Namely, that apostasy & those who follow it, carries a fairly universal fate across nearly all of the various sects of Christendom, (save those who embrace annihilationist dogma of course), that being an eternity burning in eternal torment of the lake of fire.So by all means continue your threats of eternal damnation, just understand that if you are right, in all likelihood you will be joining all the fags"" in that very same hell."""
0,,"(continued 3)is in fact the correct one. As this would require an understanding of not just scripture, but the history behind the various translations & retranslations that arisen over the centuries, & the doctrinal disputes that given rise to the various sects currently in existence & extinct at this particular time.I doubt you have a tenth of the required learning, which is rather entertaining for a very simple reason.(break 4)"
0,,"(continued 2)Like the vast majority of Christians you probably have no understanding of the Pagan roots of the vast majority of the holidays you celebrate either.The point of all this in case you are wondering is a very simple one. namely your assertion that eternal fate being a positive one based on your adherence to a religious dogma.The problem with that assertion is very simple, in all likelihood lack the prerequisite knowledge to even explain why the dogma you adhere to (break 3)"
0,,"(continued)Like most Christians you probably have no understanding of the doctrinal differences between just to name a few The Jehovah's Witnesses, The Mormons, The Orthodox Church, The Catholic Church, or the various protestant rooted denominations that sprang up in the centuries following Martin Luther.Nor in all likelihood do you have any knowledge regarding Christian sects deemed heretical in the past & stamped out like the Gnostics & the Cathars or the reasons behind it.(break 2)"
0,,"Based on what?Like the vast majority of supposed Christians in all likelihood you can't be bothered to read your bible, don't attend church for anything other than a convenient social gathering, & don't pray unless you intend to stuff your face or you want something.Like most supposed Christians you probably have no knowledge of the Apocrypha, the first council of Nicaea, or the origin of rapture dogma just to name a few things.(break)"
0,,"Matthew 7:1 - Judge Not, That You Be Not Judged."""""
0,,I'm on the weird side of YouTube
0,,We will.......
0,,lol good one fossy111
0,,"1. And who cares if they're girly""? That shouldn't even be a thing to hate. That's the same as saying ""well I hate people with blue eyes"".2. Well you seem to have a bad case of paranoia."""
0,,I do love this video. Although I can't help but think it is giving the girlfriend too much of a passive role in all this..it's kind of objectifying the girlfriend here.
1,,"u are the on making an assumption that all people who oppose gay marriage are rednecks, i assure u they are not, and u are the close minded one for thinking that everyone should think like you in the fact that they should support gay marriage, so go lick a vagina, oh wait it might burn ur lips from its cooties"
0,,LOL! Love this video.
0,,"You don't understand it, it's something different, something strange, and that's why you're repulsed by it. Perfectly understandable. Everyone's scared of something they don't understand.But in every sense, why should two men who love each other creep you out? It shouldn't, and you know it. But kudos for being honest about it.I personally believe gay rights is VERY important, possibly even more so than human trafficking. Educate yourself, there's a stream of facts that backs up my claim."
0,,"Well, looks like I need to support gay marriage now"
0,,"right"" can be interpreted any way; religiously, biologically, socially, etc. for me it is just that feeling a person gets when they feel as something is not normal or off-key"""
0,,"I can already tell i am going to get flack for this but whatever I do not like the idea of homosexuality It creeps me out a little and i don't find it to be right"" That being said i am straight so i think it would be natural to be rather repulsed by the idea. But for the rest of the world I don't care You do what you want I have my opinion like i have one of every person i know I would preferably like to skip the gay rights lecture and focus on something more important like human trafficking"""
0,,unless one of them has an x-wing
1,,Chances are gay men are not attracted to you in any way. Why I hear you cry? Cos you're a douchebag!
0,,"I have never understood this. Do you also get the feeling that every straight woman is attracted to you? That is not only a completely ignorant thing to think, but is also extremely egotistical. And who the hell cares if a gay dude is effeminate? Is that affecting your life in a negative way somehow?"
0,,I am a lesbian don't like the name but it is what it is. Been married 15 years now have know my partner more that 25 years. I think this idea is fantastic yes I said it. Me and my partner are all for this. Don't know what we would do without you guys so much fun and best friends ever.
0,,"I generally do not like gay people. The reason for that is that gay people in general are very girly (eg. All of the ones in this video) and act like women in every way. Also, i feel uncomfortable when a gay guy is around me or i talk to one because i get the feeling that he might be attracted to me and it is very awkward..."
0,,well im converted
0,,100% true hahahahaha
0,,you never take my girls :P
0,,the death star could wipe out an army of luke skywalkers. just saying :)
0,,i support gay marriage because there are way too many people on the planet. maybe not the best reason but hey you asked for it  ;)
0,,LOVE THIS lol. I'm so glad that we're moving closer toward equality for all! You WILL have your happy ending!
0,,rednecks are funny
0,,"At least I'm not believing writing from a 2,000 year old book."
0,,YOUR BEST FRIENDS GAY SO THERE'S A GOOD CHANCE HE DOESN'T KNOW WHAT HE LIKES.  OR IS THAT BI? EHH SAME DIFFERENCE
0,,I totally wish i had a gay best friend... a man can really learn a lot =)
0,,"I agree with you, and I'm straight. Gay/Lesbians have a right to express who they are freely, like straights do. Its ridiculous that they can't get married at some places, and its stupid. One of my best friends are gay, and he's probably the smartest person/funniest person I've met. So let these awesome people have the freedom of speech and such, like our founding fathers intended."
0,,"Haha the joke on you, i dont have a girlfriend!"
0,,Hilarious and oh so true.
0,,3545 people are mad cos they know it's true.
0,,"And the 100,000+ people know that it's the right thing."
0,,"I love rednecks. I hate obama and gay people"". Their insanely low IQ, made from incest family sex, just makes me feel so insanely smart. Thank you rednecks, for being so low. have a nice day :)"""
0,,I agree with you..except I don't like Obama so I'm not sure if I should agree or...XD I just don't like what OneMiley said..and relationships aren't all about sex..
0,,I'M PRETTY SURE MY GIRLFRIEND WOULDN'T LIKE A DICK COVERED IN SHIT. JUST SAYING
0,,"I'M PRETTY SURE THAT MY BEST FRIEND WHOSE GAY WOULDN'T LIKE A VAGINA COVERED IN PUSSY JUICE, PEE WIPED UP, AND PUBIC HAIR. JUST SAYING"
0,,I bb
0,,"If any man come to me, and hate not his father, and mother, and wife, and children, and brothers, and sisters, yea, and his own life also, he cannot be my disciple."" -Jesus"""
0,,Hahaha LOL
0,,"..(comment continues) What is ACTUALLY wrong with it. How are they not entitled to express there love the same way we are. I am a straight man, and I would love to have a gay guy as a friend. In my opinion, they make nicer friends. I just hope that the government in the next few years realizes that it is the right thing to do, and lets the law pass"
0,,"oh, i thought they made gay marriage possible by now in the US, or do you perhaps live in another country? There is nothing wrong being gay, maybe if people are called gay for no reason, then the word gay"" could be used as an insult since the person is heterosexual or ""straight"" I would say, that it SHOULD be normal due to that it is natural. And how can you say no to love?"""
0,,"I know.. saying no to someone loving another is like denying someones right to free will. It is just wrong.They have legalized it in, if I can remember, I think 8 American States, but I live in Australia. And this just shouldn't be based on one country, but the world."
0,,"i don't think it is mostly the governments fault, it is the people have a tough time accepting each other. And another possible thing is that some countries have very strict rules or have to respect the religion(s) in their own country. What i really like being a northener is that you can choose if you have a religion or no, but that still doesn't neccesarily make you an athiest :)"
0,,"Yeah. when we talk about this whole debate and argument, religion does play a huge part in what is said. And don't get me wrong, I'm for religion, even though I'm an Atheist. My best friend would probably have been dead if it weren't for religion. It gave her so much strength, and I'm for that. It's just that when religion starts branching out and affecting the government, and the laws.. that's when it starts to get a little bit out of hand."
0,,"I have a friend too who gets comfort in religion, its nice to see that someone confirmes the same :) anyways, i don't want to be rude, but i dont want this discussion to proceed any longer because i don't want us to exchange personal lives, it's something i have to move away from :PNo offence"
0,,It's all okay. I respect your decision. Thanks for making me think about this more.
0,,"Homosexuality is real in nature, as you said, there are so many species of animals that are proven to be homosexual. The amount of videos that I've watched about homosexuality, and most of the videos have the same answer. People who follow the bible and say that gays are sinful people, why don't you listen to all the bible. It also says that women are owned by there husbands and can not speak outside the house without his permission.But.. getting away from religion.. (comment continues).."
0,,"When I was a shooter girl at a night club a bunch of guys cheered to gay men and said more women for us"" it's true :) I wanna be married the crap out of by a gay man!!!"""
0,,oh dear god they've got us beat...
0,,i like this...the world seems like it would be happier.
0,,"Wait according to you, lesbians are logical."
0,,"For myself, hand holding and snuggling of any gender combo in public I'm totally comfortable with, but I feel uncomfortable when a guy or a girl is rubbing the crotch of his/her boyfriend, or a guy or a girl is fondling his/her girlfriend's breasts (especially if I know them) O.o For me, it's the same kind of idea when I'm alone and cross the street to avoid a strange guy; it's not because of your race or how you're dressed, it's because I'm alone and you're a strange guy, that's all :)"
0,,@MrCommentsdude queer
0,,3543 and counting
0,,"IM JUST SAYIN, Luke would've died without being saved by Han"
0,,Why does religion always pop up in the comments of vids on homosexuality? I'm a Christian and I'm offended when people say god hates gays because it clearly states in the bible that god loves everyone! Have a nice day and I love the vid! :)
0,,Where?
0,,"Not that I'm disagreeing with your general view mind you, but the bible's pretty down on homosexuality.  Kudos to you for having better morals than your theoretical source of morality though."
0,,"Hmm... the bible has a very clear set of laws set out in Leviticus, many of which are ignored now-a-days (ie: not working on the sabbath. Seriously, it's mentioned over and over and over and people ignore it because they want to ignore it) but some of which (ie: man should not lie with another man, which is mentioned once I believe) are pulled out time and again as the laws god actually wants us to follow. It's stupid as hell, but that's why. Good for you not following the herd tho :)"
0,,"You put up some valid points, but if we talked about religion, we could go for the next few years..It's at least good to realize that there are some normal people in society"
0,,"Thank you sir. Btw, did you know that even animals commit themselves into homosexuality? this could also be a proving arguement why homosexuality is natural"", just so you know that it doesn't always have to relate to religion :P.if you want to know somethign else, i am always open to more comments or suggestions, people like you are rare to come by :)"""
0,,honestly it seems like a win-win no matter what happens.
0,,Haha this is hilarious
0,,a mother-fucking kiesh
0,,It's spelled quiche.
0,,"I would live to hack into fox news and put this in the commercials, just to piss off the eighty year old geezers who watch that crap."
1,,you sound like the KKK
0,,biosexual?
0,,"love everyone as your equals""-Jesus"""
1,,hahaha loser
0,,Redneck
0,,i have a question about homosexuality one day i was walking down the street and a kid called me a gay faggot my question is does that mean im straight or twice as gay?
0,,hmm... actually has some good points :/
0,,At least i wont be burning in hell with all the fags.
1,,atlest i fucked yo mama
0,,Rock on!
0,,I watch this everyday.
0,,Mitt Romney has a lot of computers
0,,Oh yeah? What if I marry her first? Now your whole plan has failed. Miserably.
1,,bitch you would never get a gf
0,,"If my girlfriend would leave me for a gay guy, you're all doing me a favor! So fuck off faggots!"
1,,you're a faggot
0,,odd i am straight and i have all those traits
0,,"I get that you dont like people talking bad stuff about homosexuals.. But you really cant compare one who hates gays, to one who indirectly was responsible of the death og 6 million people."
0,,Dont take my girlfriend :(
0,,your grandchildren will look back on you with the same shame that i look back on my racist relatives with.  how does that feel?
0,,1:16 - 1:20 <3
0,,"Actually.. I'm just going to call you out on something you said there, Know what feels better than b-hole? A vagina ""How come most guys want anal with women. They love the ass. So, apart from the fact that you're comment is horrible and makes you practically the same as the first Europeans. They went around despising black people. Now look at society these days. America has a black president. So just you wait and see in ten years in the future when gay marriage is legal, and you're the fuckwit"""
0,,"You took a guy with One Miley Cyrus Fan"" in his name serious? I agree with you though."""
0,,"I know I probably shouldn't have taken him seriously, but it's just a topic I'm very passionate about xD"
0,,"Well said! (Im not a homosexual, but i support Gay/Lesbian marriage)"
0,,"Everybody should. There is NOTHING wrong with it.. (except for a 2,000 year old book that says that it's wrong) And who will we listen to.. society and the real facts.. or the book."
0,,"meh, i'm not religious but religious people are a joke, i mean, they say they follow their own book which is their guide of life. And then there are extremists that say they follow the book but breaks some of the simplest rules such as killing for example, or sharing. but lets not get into religious details now right?"
0,,I'm actually married to a gay man. Best decision I ever made.
0,,Can someone explain something to me please? Why do some people think that their country is going to s*** just because gay people can get married? I don't understand how that can affect society or de-value traditional marriage.  I don't understand why religion is involved in government and law.. Somebody else's religion shouldn't stop me from marrying a woman if I was gay.
1,,How do you know the vagina feels better than the b-hole? Oops closet gay guy coming up!
0,,Only Steers and Queers come from Texas and you are obviously not a steer so..
1,,so you're admitting to trying b-hole. sounds kinda gay. how's the closet?
1,,"people like you are the reason our country has gone to shit, retarded people that let religion or some other dumbshit reason to cloud logic and reason. FUCK YOU DUMBASS"
0,,So funny...and soooo true:)
0,,A motherfuckin quiche
0,,This video was awesome x3 just saying
0,,"About the vagina being better and blah blah blah... I believe a lot of girls agree with you! =) Go matter your own sex life, bro."
0,,"Marriage politics aside, I can't be the only one who found this video extremely patronizing and insulting on a number of levels."
0,,Some how all gay men are ripped it doesn't seem possible but it is
0,,Stereotypes! Stereotypes everywhere! I swear i'd be considered gay due to society's labels ._.
0,,Good luck fags
0,,"Exactly! Just imagine what kind of people would be persecuted if the controversy was this big about pre-marital intimacy, right? A handful of the people that are even now accusing homosexual people. There are different things that everyone needs to work on."
0,,What if you're a metrosexual.
0,,Why men are afraid of other gay man? What will happen? Less pussy for you?You idiots... xD
0,,The guy in the coral button up sitting in front of the pool was def the most FABULOUS!
0,,"hi, I am luis from puerto rico, we are fighting over here for the right, for gay people to marry, there is a section of ultra-religous people that are spreading hatred all around, even calling homosexuals demons and possessed by the devil... help us boicot this boycott this group... our facebook page is called... boicot a pr por la familia"
0,,You are a badass motherf*cker!
0,,"Actually, these guys wouldn't be able to marry these girls...they would more than likely become part of the friendzone."
0,,"You know that's will depend on how big is their..._ you know what. Of course there are exceptions, we know it: Justin Bieber, she... or he... looks like a lesbian and girls (dumb girls) still love her... him."
0,,Faggggssss
0,,"OMG for those who quote the bible as a place of protection that its not right to be gay or lesbian whatever it may be you are not obviously following god just your commitment to being asswholes as i recall god does not change free will thats is a choice of our own decide whats for yourself not for others heres a quote  who gave you the right to judge "" as i see you guys dont know shit about me or anyother so dont choose my life for me"""
0,,J'aime
0,,Only the guys at college humor would make something like this funny.
0,,"...more like a Texan than Hitler."" I don;t even know how to clearly express how much that pissed me off. I'm a proud Texan, and most of the shit on the internet is taken as a joke (because for the most part it is). However, you compared us to a lesser Hitler, due to some assumption that we hate gays. No, no. Just no..."""
0,,"And now I remember why I hated school, close-minded idiots who believed that I actually cared about what they said, much like yourself.I am not gay myself, but I find it horribly ridiculous that anyone would call themselves grown"" or an ""adult"" and have opinions as ludicrous and childish as this.And ya know what? my Grandfather is a texan, and my uncle is gay. My grandfather is also an ex-marine and is fine with it. You try to lay a hand on his son, or his sons husband, your not gonna live."""
0,,Hey ChunkyBuiscuit no Reply????
0,,that's what the straight guy i fucked last week said...
0,,faggots
0,,"0:56 a motherf*cking kish"" Haha! :D"""
0,,*quiche
0,,It's moving until you watch this vid watch?v=r0Be8LnuG3U
0,,"Actually it feels way better when you stick it up a girls pooper, you know... because it's tighter :D"
0,,3536 guy's girlfriends ran off with a gay guy
0,,"And the historian Edward Gibbon remarks that of the first fifteen emperors, Claudius was the only one whose taste in love was entirely correct."" I really don't think your argument, which is based off of literally just old gossip, has a leg to stand on."""
0,,I'd totally marry a gay man...
0,,"This video is hilarious! Good job, guys!"
0,,i love it!
0,,"Rome was founded by literally the dregs of society. They were so undesirable that they had to steal women to be their wives because no one would marry the. Then they proceeded to make war on their new in-laws... I think they were pretty much immoral from the start. Oh and you know the cluster of emperors, known as the five good emperors, that reigned over the empire during it's golden age. One of them, Hadrian infract, was gay."
0,,That first guy's so freaking hot. No homo
0,,"I know, his curly, luscious locks and those brown eyes are super sexyy"
1,,"You should worship your god to save him from doing to you what he would if you didn't worship him! Haha, pathetic"
0,,"so that's why people go to a pit of eternal damnation and hellfire. Because God loves us,"
0,,Well that's one down.
0,,"So basically he hates homosexuals, but it's okay because he says he loves them anyways?I call shenanigans."
0,,But yet the bible says that you're allowed to stone your children to death if they disobey you. Bible also says that if you aren't a part of ____ religion then you're going straight to _____. Most religions are contradictory in themselves. That's why I choose to stand on the sidelines and laugh at everyone who fight with each other.
